{
  "evidence_id":"EVD-G0-PMPLAN-001","project_id":"FHZ-ENTERPRISE-001","schema_version":"1.0.0","evidence_type":"decision","title":"Forge H2 PM Plan working baseline","source":{"uri":"https://forge-h2.local/docs/03-governance/pm-plan.md","owner":"Forge H2 PMO","document_number":"FHZ-PM-PLAN-001","revision":"working-tree-2026-09-22","locator":"document root","retrieved_at":"2026-09-22T09:10:00Z"},"issued_at":"2026-09-22","effective_from":null,"effective_to":null,"content_hash":"sha256:ec1b011acbce651fea221152ba818287b480a022f406c5c1c7974684601bd4b7","reliability_tier":"T4","verification_status":"unverified","scope":{"applies_to":["G0","all phases"],"limitations":["human approval pending"],"jurisdiction":"KR","capacity_range":null},"claims":[],"verified_by":null,"verified_at":null,"used_by_missions":["M-001","M-010"],"supersedes":[],"superseded_by":null,"created_at":"2026-09-22T09:10:00Z","extensions":{"local_path":"docs/03-governance/pm-plan.md"}
}
