{
  "evidence_id":"EVD-G0-OFFLINE-001","project_id":"FHZ-ENTERPRISE-001","schema_version":"1.0.0","evidence_type":"dataset","title":"Offline source register and baseline readiness result","source":{"uri":"https://forge-h2.local/knowledge/offline-source-register.json","owner":"Forge H2 Data/Evidence Lead","document_number":"FHZ-OFFLINE-REGISTER-001","revision":"working-tree-2026-09-22","locator":"sources[] and status","retrieved_at":"2026-09-22T09:10:00Z"},"issued_at":"2026-09-22","effective_from":null,"effective_to":null,"content_hash":"sha256:645b1e04ddd0967eccf08aac84e496cca44f823a7e8b477e7596562f9ac4fc3a","reliability_tier":"T4","verification_status":"unverified","scope":{"applies_to":["G0","offline baseline"],"limitations":["9 required sources remain metadata_only"],"jurisdiction":"KR","capacity_range":null},"claims":[],"verified_by":null,"verified_at":null,"used_by_missions":["M-002","M-006","M-010"],"supersedes":[],"superseded_by":null,"created_at":"2026-09-22T09:10:00Z","extensions":{"local_path":"knowledge/offline-source-register.json","baseline_ready":false}
}
