{
  "evidence_id":"EVD-G0-GATE-001","project_id":"FHZ-ENTERPRISE-001","schema_version":"1.0.0","evidence_type":"decision","title":"Forge H2 gate criteria working baseline","source":{"uri":"https://forge-h2.local/docs/03-governance/gate-criteria.md","owner":"Forge H2 PMO and Chief Engineer","document_number":"FHZ-GATE-CRITERIA-001","revision":"working-tree-2026-09-22","locator":"document root","retrieved_at":"2026-09-22T09:10:00Z"},"issued_at":"2026-09-22","effective_from":null,"effective_to":null,"content_hash":"sha256:ebb08b5fc588f7cb13e839e6fac3e14e28362e8b73997f19b21c505b816be3f6","reliability_tier":"T4","verification_status":"unverified","scope":{"applies_to":["G0","G1","G2","G3","G4","G5","G6","G7"],"limitations":["human approval pending"],"jurisdiction":"KR","capacity_range":null},"claims":[],"verified_by":null,"verified_at":null,"used_by_missions":["M-009","M-010"],"supersedes":[],"superseded_by":null,"created_at":"2026-09-22T09:10:00Z","extensions":{"local_path":"docs/03-governance/gate-criteria.md"}
}
