{
  "evidence_id":"EVD-G0-DECISION-001","project_id":"FHZ-ENTERPRISE-001","schema_version":"1.0.0","evidence_type":"decision","title":"G0 HOLD decision log","source":{"uri":"https://forge-h2.local/docs/03-governance/decision-log.md","owner":"Forge H2 PMO","document_number":"FHZ-DECISION-LOG-001","revision":"working-tree-2026-09-22","locator":"D-021","retrieved_at":"2026-09-22T09:10:00Z"},"issued_at":"2026-09-22","effective_from":null,"effective_to":null,"content_hash":"sha256:7197ca648f06e8674d7abd6a89bff787fac4ae31379ef57e8145641ac4c7d570","reliability_tier":"T4","verification_status":"unverified","scope":{"applies_to":["G0","D-021"],"limitations":["human signoff pending"],"jurisdiction":"KR","capacity_range":null},"claims":[],"verified_by":null,"verified_at":null,"used_by_missions":["M-009","M-010"],"supersedes":[],"superseded_by":null,"created_at":"2026-09-22T09:10:00Z","extensions":{"local_path":"docs/03-governance/decision-log.md"}
}
