{
  "evidence_id":"EVD-G0-REQ-001","project_id":"FHZ-ENTERPRISE-001","schema_version":"1.0.0","evidence_type":"dataset","title":"Forge H2 requirements baseline working draft","source":{"uri":"https://forge-h2.local/docs/03-governance/requirements-baseline.md","owner":"Forge H2 Product and PMO","document_number":"FHZ-REQ-001","revision":"working-tree-2026-09-22","locator":"document root","retrieved_at":"2026-09-22T09:10:00Z"},"issued_at":"2026-09-22","effective_from":null,"effective_to":null,"content_hash":"sha256:70f05bc068621d82b9003781e00aa848109a525d97c629799224c003b573ea46","reliability_tier":"T4","verification_status":"unverified","scope":{"applies_to":["G0","M-001","M-002","M-006"],"limitations":["actual ProjectIntent values missing"],"jurisdiction":"KR","capacity_range":null},"claims":[],"verified_by":null,"verified_at":null,"used_by_missions":["M-001","M-002","M-006"],"supersedes":[],"superseded_by":null,"created_at":"2026-09-22T09:10:00Z","extensions":{"local_path":"docs/03-governance/requirements-baseline.md"}
}
