{
  "evidence_id":"EVD-G0-CHARTER-001","project_id":"FHZ-ENTERPRISE-001","schema_version":"1.0.0","evidence_type":"decision","title":"Forge H2 Project Charter working baseline","source":{"uri":"https://forge-h2.local/docs/00-project/project-charter.md","owner":"Forge H2 PMO","document_number":"FHZ-CHARTER-001","revision":"working-tree-2026-09-22","locator":"document root","retrieved_at":"2026-09-22T09:10:00Z"},"issued_at":"2026-09-22","effective_from":null,"effective_to":null,"content_hash":"sha256:ad74c5bea1e6298b7d3ad2c42fcb41fc2d12eb0c706cf8a792ff78e6e95a6b2a","reliability_tier":"T4","verification_status":"unverified","scope":{"applies_to":["G0","M-001","M-010"],"limitations":["human approval pending"],"jurisdiction":"KR","capacity_range":null},"claims":[],"verified_by":null,"verified_at":null,"used_by_missions":["M-001","M-010"],"supersedes":[],"superseded_by":null,"created_at":"2026-09-22T09:10:00Z","extensions":{"local_path":"docs/00-project/project-charter.md"}
}
