{
  "evidence_id":"EVD-G0-RISK-001","project_id":"FHZ-ENTERPRISE-001","schema_version":"1.0.0","evidence_type":"dataset","title":"Forge H2 risk register working baseline","source":{"uri":"https://forge-h2.local/docs/03-governance/risk-register.md","owner":"Forge H2 PMO","document_number":"FHZ-RISK-001","revision":"working-tree-2026-09-22","locator":"document root","retrieved_at":"2026-09-22T09:10:00Z"},"issued_at":"2026-09-22","effective_from":null,"effective_to":null,"content_hash":"sha256:abe2056470821ee58ea25906dfbb83277d79f25212de04ae66f9782726403195","reliability_tier":"T4","verification_status":"unverified","scope":{"applies_to":["G0","risk management"],"limitations":["risk owners and treatments require human confirmation"],"jurisdiction":"KR","capacity_range":null},"claims":[],"verified_by":null,"verified_at":null,"used_by_missions":["M-009","M-010"],"supersedes":[],"superseded_by":null,"created_at":"2026-09-22T09:10:00Z","extensions":{"local_path":"docs/03-governance/risk-register.md"}
}
